StartDate,EndDate,Status,IPAddress,Progress,Duration (in seconds),Finished,RecordedDate,ResponseId,RecipientLastName,RecipientFirstName,RecipientEmail,ExternalReference,LocationLatitude,LocationLongitude,DistributionChannel,UserLanguage,Q1,Q189_First Click,Q189_Last Click,Q189_Page Submit,Q189_Click Count,Q2,Q190_First Click,Q190_Last Click,Q190_Page Submit,Q190_Click Count,Q3,Q191_First Click,Q191_Last Click,Q191_Page Submit,Q191_Click Count,Q4,Q192_First Click,Q192_Last Click,Q192_Page Submit,Q192_Click Count,Q5,Q193_First Click,Q193_Last Click,Q193_Page Submit,Q193_Click Count,Q6,Q194_First Click,Q194_Last Click,Q194_Page Submit,Q194_Click Count,Q7,Q196_First Click,Q196_Last Click,Q196_Page Submit,Q196_Click Count,Q8,Q197_First Click,Q197_Last Click,Q197_Page Submit,Q197_Click Count,Q9,Q198_First Click,Q198_Last Click,Q198_Page Submit,Q198_Click Count,Q10,Q199_First Click,Q199_Last Click,Q199_Page Submit,Q199_Click Count,Q11,Q200_First Click,Q200_Last Click,Q200_Page Submit,Q200_Click Count,Q12,Q201_First Click,Q201_Last Click,Q201_Page Submit,Q201_Click Count,Q13,Q202_First Click,Q202_Last Click,Q202_Page Submit,Q202_Click Count,Q14,Q203_First Click,Q203_Last Click,Q203_Page Submit,Q203_Click Count,Q15,Q204_First Click,Q204_Last Click,Q204_Page Submit,Q204_Click Count,Q16,Q205_First Click,Q205_Last Click,Q205_Page Submit,Q205_Click Count,Q17,Q174_First Click,Q174_Last Click,Q174_Page Submit,Q174_Click Count,Q18,Q207_First Click,Q207_Last Click,Q207_Page Submit,Q207_Click Count,Q19,Q175_First Click,Q175_Last Click,Q175_Page Submit,Q175_Click Count,Q20,Q176_First Click,Q176_Last Click,Q176_Page Submit,Q176_Click Count,Q21,Q177_First Click,Q177_Last Click,Q177_Page Submit,Q177_Click Count,Q22,Q178_First Click,Q178_Last Click,Q178_Page Submit,Q178_Click Count,Q23,Q179_First Click,Q179_Last Click,Q179_Page Submit,Q179_Click Count,Q24,Q180_First Click,Q180_Last Click,Q180_Page Submit,Q180_Click Count,Q25,Q181_First Click,Q181_Last Click,Q181_Page Submit,Q181_Click Count,Q26,Q182_First Click,Q182_Last Click,Q182_Page Submit,Q182_Click Count,Q27,Q183_First Click,Q183_Last Click,Q183_Page Submit,Q183_Click Count,Q28,Q184_First Click,Q184_Last Click,Q184_Page Submit,Q184_Click Count,Q29,Q185_First Click,Q185_Last Click,Q185_Page Submit,Q185_Click Count,Q30,Q186_First Click,Q186_Last Click,Q186_Page Submit,Q186_Click Count,Q31,Q187_First Click,Q187_Last Click,Q187_Page Submit,Q187_Click Count,Q32,Q188_First Click,Q188_Last Click,Q188_Page Submit,Q188_Click Count,Q33,Q34
Start Date,End Date,Response Type,IP Address,Progress,Duration (in seconds),Finished,Recorded Date,Response ID,Recipient Last Name,Recipient First Name,Recipient Email,External Data Reference,Location Latitude,Location Longitude,Distribution Channel,User Language,"On average, which team has members who are more proficient with website skills?",Timing - First Click,Timing - Last Click,Timing - Page Submit,Timing - Click Count,"On average, which team is proficient with database skills?",Timing - First Click,Timing - Last Click,Timing - Page Submit,Timing - Click Count,"On average, which team has members who are more proficient with time management skills?",Timing - First Click,Timing - Last Click,Timing - Page Submit,Timing - Click Count,"On average, which team has members who are more proficient with communication skills?",Timing - First Click,Timing - Last Click,Timing - Page Submit,Timing - Click Count,"On average, which team has members who are more proficient with time management skills?",Timing - First Click,Timing - Last Click,Timing - Page Submit,Timing - Click Count,"On average, which team has members who are more proficient with database skills?",Timing - First Click,Timing - Last Click,Timing - Page Submit,Timing - Click Count,"On average, which team has members who are more proficient with communication skills?",Timing - First Click,Timing - Last Click,Timing - Page Submit,Timing - Click Count,"On average, which team has members who are more proficient with website skills?",Timing - First Click,Timing - Last Click,Timing - Page Submit,Timing - Click Count,Which member should move from Team A to Team B?,Timing - First Click,Timing - Last Click,Timing - Page Submit,Timing - Click Count,Which member should move from Team A to Team B?,Timing - First Click,Timing - Last Click,Timing - Page Submit,Timing - Click Count,Which member should move from Team A to Team B?,Timing - First Click,Timing - Last Click,Timing - Page Submit,Timing - Click Count,Which member should move from Team A to Team B?,Timing - First Click,Timing - Last Click,Timing - Page Submit,Timing - Click Count,"Your goal is to have members who have strong skills be spread out across the teams. Which scenario is better for meeting your goal?

 

Scenario 1



Scenario 2",Timing - First Click,Timing - Last Click,Timing - Page Submit,Timing - Click Count,"Your goal is to have members work with others who are at a similar skill level as themselves. Which scenario is better for meeting your goal?
 
Scenario 1



Scenario 2",Timing - First Click,Timing - Last Click,Timing - Page Submit,Timing - Click Count,"Your goal is to form teams so that members who are good at different skills can complement and help each other out within the same team. Which scenario is better for meeting your goal?

 
Scenario 1

   

Scenario 2",Timing - First Click,Timing - Last Click,Timing - Page Submit,Timing - Click Count,"Your goal is to form teams so that strong students can mentor weak students within each team. Which scenario is better for meeting your goal?

  
Scenario 1



Scenario 2",Timing - First Click,Timing - Last Click,Timing - Page Submit,Timing - Click Count,"On average, which team has members who are more proficient with website skills?",Timing - First Click,Timing - Last Click,Timing - Page Submit,Timing - Click Count,"On average, which team has members who are more proficient with database skills?",Timing - First Click,Timing - Last Click,Timing - Page Submit,Timing - Click Count,"On average, which team has members who are more proficient with communication skills?",Timing - First Click,Timing - Last Click,Timing - Page Submit,Timing - Click Count,"On average, which team has members who are more proficient with time management skills?",Timing - First Click,Timing - Last Click,Timing - Page Submit,Timing - Click Count,"On average, which team has members who are more proficient with website skills?",Timing - First Click,Timing - Last Click,Timing - Page Submit,Timing - Click Count,"On average, which team has members who are more proficient with database skills?",Timing - First Click,Timing - Last Click,Timing - Page Submit,Timing - Click Count,"On average, which team has members who are more proficient with time management skills?",Timing - First Click,Timing - Last Click,Timing - Page Submit,Timing - Click Count,"On average, which team has members who are more proficient with communication skills?",Timing - First Click,Timing - Last Click,Timing - Page Submit,Timing - Click Count,Which member should move from Team A to Team B?,Timing - First Click,Timing - Last Click,Timing - Page Submit,Timing - Click Count,Which member should move from Team A to Team B?,Timing - First Click,Timing - Last Click,Timing - Page Submit,Timing - Click Count,Which member should move from Team A to Team B?,Timing - First Click,Timing - Last Click,Timing - Page Submit,Timing - Click Count,Which member should move from Team A to Team B?,Timing - First Click,Timing - Last Click,Timing - Page Submit,Timing - Click Count,"Your goal is to have members who have strong skills be spread out across the teams. Which scenario is better for meeting your goal?

 

Scenario 1



Scenario 2",Timing - First Click,Timing - Last Click,Timing - Page Submit,Timing - Click Count,"Your goal is to have members work with others who are at a similar skill level as themselves. Which scenario is better for meeting your goal?
 
Scenario 1



Scenario 2",Timing - First Click,Timing - Last Click,Timing - Page Submit,Timing - Click Count,"Your goal is to form teams so that strong students can mentor weak students within each team. Which scenario is better for meeting your goal?
   


Scenario 1



Scenario 2",Timing - First Click,Timing - Last Click,Timing - Page Submit,Timing - Click Count,"Your goal is to form teams so that members who are good at different skills can complement and help each other out within the same team. Which scenario is better for meeting your goal?
  


Scenario 1



Scenario 2",Timing - First Click,Timing - Last Click,Timing - Page Submit,Timing - Click Count,"You saw two types of graphs in the previous questions that helped visualize the skills of individuals in a team. We show an example of each type of graph below for reference. On the left, we have a stacked bar graph. On the right, we have a grouped bar graph.
 

We want to know which visualization you find easier to interpret the skills of individuals on a team and to review the overall skills of each team. 

 

Select the visualization that you find easier to understand and explain why in the next question.



Examples",Please explain your choice so we can understand what you like about that type of visualization:
"{""ImportId"":""startDate"",""timeZone"":""America/Denver""}","{""ImportId"":""endDate"",""timeZone"":""America/Denver""}","{""ImportId"":""status""}","{""ImportId"":""ipAddress""}","{""ImportId"":""progress""}","{""ImportId"":""duration""}","{""ImportId"":""finished""}","{""ImportId"":""recordedDate"",""timeZone"":""America/Denver""}","{""ImportId"":""_recordId""}","{""ImportId"":""recipientLastName""}","{""ImportId"":""recipientFirstName""}","{""ImportId"":""recipientEmail""}","{""ImportId"":""externalDataReference""}","{""ImportId"":""locationLatitude""}","{""ImportId"":""locationLongitude""}","{""ImportId"":""distributionChannel""}","{""ImportId"":""userLanguage""}","{""ImportId"":""QID128""}","{""ImportId"":""QID213_FIRST_CLICK""}","{""ImportId"":""QID213_LAST_CLICK""}","{""ImportId"":""QID213_PAGE_SUBMIT""}","{""ImportId"":""QID213_CLICK_COUNT""}","{""ImportId"":""QID130""}","{""ImportId"":""QID214_FIRST_CLICK""}","{""ImportId"":""QID214_LAST_CLICK""}","{""ImportId"":""QID214_PAGE_SUBMIT""}","{""ImportId"":""QID214_CLICK_COUNT""}","{""ImportId"":""QID134""}","{""ImportId"":""QID215_FIRST_CLICK""}","{""ImportId"":""QID215_LAST_CLICK""}","{""ImportId"":""QID215_PAGE_SUBMIT""}","{""ImportId"":""QID215_CLICK_COUNT""}","{""ImportId"":""QID132""}","{""ImportId"":""QID216_FIRST_CLICK""}","{""ImportId"":""QID216_LAST_CLICK""}","{""ImportId"":""QID216_PAGE_SUBMIT""}","{""ImportId"":""QID216_CLICK_COUNT""}","{""ImportId"":""QID152""}","{""ImportId"":""QID217_FIRST_CLICK""}","{""ImportId"":""QID217_LAST_CLICK""}","{""ImportId"":""QID217_PAGE_SUBMIT""}","{""ImportId"":""QID217_CLICK_COUNT""}","{""ImportId"":""QID148""}","{""ImportId"":""QID219_FIRST_CLICK""}","{""ImportId"":""QID219_LAST_CLICK""}","{""ImportId"":""QID219_PAGE_SUBMIT""}","{""ImportId"":""QID219_CLICK_COUNT""}","{""ImportId"":""QID150""}","{""ImportId"":""QID220_FIRST_CLICK""}","{""ImportId"":""QID220_LAST_CLICK""}","{""ImportId"":""QID220_PAGE_SUBMIT""}","{""ImportId"":""QID220_CLICK_COUNT""}","{""ImportId"":""QID146""}","{""ImportId"":""QID221_FIRST_CLICK""}","{""ImportId"":""QID221_LAST_CLICK""}","{""ImportId"":""QID221_PAGE_SUBMIT""}","{""ImportId"":""QID221_CLICK_COUNT""}","{""ImportId"":""QID164""}","{""ImportId"":""QID222_FIRST_CLICK""}","{""ImportId"":""QID222_LAST_CLICK""}","{""ImportId"":""QID222_PAGE_SUBMIT""}","{""ImportId"":""QID222_CLICK_COUNT""}","{""ImportId"":""QID166""}","{""ImportId"":""QID223_FIRST_CLICK""}","{""ImportId"":""QID223_LAST_CLICK""}","{""ImportId"":""QID223_PAGE_SUBMIT""}","{""ImportId"":""QID223_CLICK_COUNT""}","{""ImportId"":""QID170""}","{""ImportId"":""QID224_FIRST_CLICK""}","{""ImportId"":""QID224_LAST_CLICK""}","{""ImportId"":""QID224_PAGE_SUBMIT""}","{""ImportId"":""QID224_CLICK_COUNT""}","{""ImportId"":""QID168""}","{""ImportId"":""QID225_FIRST_CLICK""}","{""ImportId"":""QID225_LAST_CLICK""}","{""ImportId"":""QID225_PAGE_SUBMIT""}","{""ImportId"":""QID225_CLICK_COUNT""}","{""ImportId"":""QID182""}","{""ImportId"":""QID226_FIRST_CLICK""}","{""ImportId"":""QID226_LAST_CLICK""}","{""ImportId"":""QID226_PAGE_SUBMIT""}","{""ImportId"":""QID226_CLICK_COUNT""}","{""ImportId"":""QID184""}","{""ImportId"":""QID227_FIRST_CLICK""}","{""ImportId"":""QID227_LAST_CLICK""}","{""ImportId"":""QID227_PAGE_SUBMIT""}","{""ImportId"":""QID227_CLICK_COUNT""}","{""ImportId"":""QID188""}","{""ImportId"":""QID228_FIRST_CLICK""}","{""ImportId"":""QID228_LAST_CLICK""}","{""ImportId"":""QID228_PAGE_SUBMIT""}","{""ImportId"":""QID228_CLICK_COUNT""}","{""ImportId"":""QID186""}","{""ImportId"":""QID229_FIRST_CLICK""}","{""ImportId"":""QID229_LAST_CLICK""}","{""ImportId"":""QID229_PAGE_SUBMIT""}","{""ImportId"":""QID229_CLICK_COUNT""}","{""ImportId"":""QID136""}","{""ImportId"":""QID198_FIRST_CLICK""}","{""ImportId"":""QID198_LAST_CLICK""}","{""ImportId"":""QID198_PAGE_SUBMIT""}","{""ImportId"":""QID198_CLICK_COUNT""}","{""ImportId"":""QID138""}","{""ImportId"":""QID231_FIRST_CLICK""}","{""ImportId"":""QID231_LAST_CLICK""}","{""ImportId"":""QID231_PAGE_SUBMIT""}","{""ImportId"":""QID231_CLICK_COUNT""}","{""ImportId"":""QID140""}","{""ImportId"":""QID199_FIRST_CLICK""}","{""ImportId"":""QID199_LAST_CLICK""}","{""ImportId"":""QID199_PAGE_SUBMIT""}","{""ImportId"":""QID199_CLICK_COUNT""}","{""ImportId"":""QID142""}","{""ImportId"":""QID200_FIRST_CLICK""}","{""ImportId"":""QID200_LAST_CLICK""}","{""ImportId"":""QID200_PAGE_SUBMIT""}","{""ImportId"":""QID200_CLICK_COUNT""}","{""ImportId"":""QID154""}","{""ImportId"":""QID201_FIRST_CLICK""}","{""ImportId"":""QID201_LAST_CLICK""}","{""ImportId"":""QID201_PAGE_SUBMIT""}","{""ImportId"":""QID201_CLICK_COUNT""}","{""ImportId"":""QID156""}","{""ImportId"":""QID202_FIRST_CLICK""}","{""ImportId"":""QID202_LAST_CLICK""}","{""ImportId"":""QID202_PAGE_SUBMIT""}","{""ImportId"":""QID202_CLICK_COUNT""}","{""ImportId"":""QID160""}","{""ImportId"":""QID203_FIRST_CLICK""}","{""ImportId"":""QID203_LAST_CLICK""}","{""ImportId"":""QID203_PAGE_SUBMIT""}","{""ImportId"":""QID203_CLICK_COUNT""}","{""ImportId"":""QID158""}","{""ImportId"":""QID204_FIRST_CLICK""}","{""ImportId"":""QID204_LAST_CLICK""}","{""ImportId"":""QID204_PAGE_SUBMIT""}","{""ImportId"":""QID204_CLICK_COUNT""}","{""ImportId"":""QID178""}","{""ImportId"":""QID205_FIRST_CLICK""}","{""ImportId"":""QID205_LAST_CLICK""}","{""ImportId"":""QID205_PAGE_SUBMIT""}","{""ImportId"":""QID205_CLICK_COUNT""}","{""ImportId"":""QID172""}","{""ImportId"":""QID206_FIRST_CLICK""}","{""ImportId"":""QID206_LAST_CLICK""}","{""ImportId"":""QID206_PAGE_SUBMIT""}","{""ImportId"":""QID206_CLICK_COUNT""}","{""ImportId"":""QID176""}","{""ImportId"":""QID207_FIRST_CLICK""}","{""ImportId"":""QID207_LAST_CLICK""}","{""ImportId"":""QID207_PAGE_SUBMIT""}","{""ImportId"":""QID207_CLICK_COUNT""}","{""ImportId"":""QID174""}","{""ImportId"":""QID208_FIRST_CLICK""}","{""ImportId"":""QID208_LAST_CLICK""}","{""ImportId"":""QID208_PAGE_SUBMIT""}","{""ImportId"":""QID208_CLICK_COUNT""}","{""ImportId"":""QID190""}","{""ImportId"":""QID209_FIRST_CLICK""}","{""ImportId"":""QID209_LAST_CLICK""}","{""ImportId"":""QID209_PAGE_SUBMIT""}","{""ImportId"":""QID209_CLICK_COUNT""}","{""ImportId"":""QID192""}","{""ImportId"":""QID210_FIRST_CLICK""}","{""ImportId"":""QID210_LAST_CLICK""}","{""ImportId"":""QID210_PAGE_SUBMIT""}","{""ImportId"":""QID210_CLICK_COUNT""}","{""ImportId"":""QID194""}","{""ImportId"":""QID211_FIRST_CLICK""}","{""ImportId"":""QID211_LAST_CLICK""}","{""ImportId"":""QID211_PAGE_SUBMIT""}","{""ImportId"":""QID211_CLICK_COUNT""}","{""ImportId"":""QID196""}","{""ImportId"":""QID212_FIRST_CLICK""}","{""ImportId"":""QID212_LAST_CLICK""}","{""ImportId"":""QID212_PAGE_SUBMIT""}","{""ImportId"":""QID212_CLICK_COUNT""}","{""ImportId"":""QID49""}","{""ImportId"":""QID50_TEXT""}"
2021-12-06 20:54:52,2021-12-06 21:49:44,IP Address,142.231.42.45,100,3292,True,2021-12-06 21:49:45,R_2zO3BlZTzWxd5XF,,,,,49.9492950439453125,-119.439697265625,anonymous,EN,Members in Team C are more proficient,7.049,7.049,8.165,1,Members in Team C are more proficient,18.385,18.385,19.612,1,Members in Team C are more proficient,4.991,4.991,6.057,1,Members in Team C are more proficient,5.092,5.628,6.528,2,Members in Team H are more proficient,4.738,4.738,5.963,1,Members in Team H are more proficient,7.898,7.898,8.963,1,Members in Team G are more proficient,2.222,2.222,3.352,1,Members in Team G are more proficient,1.526,1.526,2.878,1,Move Blake to team B,49.567,49.567,50.48,1,Move Blake to team B,5.96,5.96,7.163,1,I can't tell from the graph,14.149,14.149,15.213,1,Move no one,8.273,8.273,9.435,1,Scenario 1 is better for my class,3.858,4.819,5.802,3,Scenario 2 is better for my class,1.414,2.219,3.205,2,Scenario 1 is better for my class,5.06,5.06,6.065,1,Scenario 1 is better for my class,1.863,1.863,3.247,1,Members in Team A are more proficient,198.528,201.009,205.352,2,Members in Team A are more proficient,,,,,Members in Team B are more proficient,6.233,7.195,7.609,2,Members in Team A are more proficient,22.386,108.897,110.211,4,Members in Team F are more proficient,22.282,22.282,23.102,1,Members in Team F are more proficient,12.184,12.184,13.134,1,Members in Team F are more proficient,249.109,249.109,250.701,1,Members in Team E are more proficient,4.947,4.947,5.809,1,Move Cole to team B,23.306,23.306,24.81,1,Move Cole to Team B,148.483,206.593,207.76,3,Move no one,38.034,38.034,39.147,1,Move no one,5.628,5.628,6.62,1,Scenario 1 is better for my class,359.085,359.085,365.823,1,Scenario 2 is better for my class,277.832,277.832,279.068,1,Scenario 1 is better for my class,90.056,90.056,91.395,1,Scenario 2 is better for my class,531.167,531.167,533.846,1,Grouped Bar Graph is easier to understand,
2021-12-06 23:02:22,2021-12-06 23:22:08,IP Address,24.71.96.164,100,1185,True,2021-12-06 23:22:08,R_1hzBCYJYZ1dxOmX,,,,,49.9492950439453125,-119.439697265625,anonymous,EN,Members in Team C are more proficient,22.601,22.601,24.433,1,Members in Team C are more proficient,10.811,10.811,12.155,1,Members in Team C are more proficient,9.941,9.941,11.71,1,Members in Team D are more proficient,4.977,4.977,6.406,1,Members in Team G are more proficient,11.821,11.821,13.775,1,Members in Team G are more proficient,4.734,6.07,7.08,3,Members in Team G are more proficient,6.436,6.436,7.779,1,Members in Team G are more proficient,1.826,1.826,6.062,1,Move no one,64.693,84.093,88.215,2,Move Cole to team B,10.092,12.262,13.366,3,Move no one,31.713,49.117,50.133,2,Move no one,15.549,15.549,17.055,1,Scenario 2 is better for my class,63.396,66.153,78.383,2,Scenario 2 is better for my class,5.722,6.395,7.231,2,Scenario 2 is better for my class,32.825,32.825,34.364,1,Scenario 1 is better for my class,7.944,7.944,9.482,1,Members in Team B are more proficient,64.529,64.529,186.512,1,Members in Team A are more proficient,124.621,125.556,127.93,2,Members in Team B are more proficient,30.353,30.353,33.316,1,Members in Team B are more proficient,16.334,23.496,24.884,2,Members in Team F are more proficient,39.712,39.712,40.902,1,Members in Team F are more proficient,10.571,10.571,11.776,1,Members in Team E are more proficient,4.142,6.969,7.871,2,Members in Team E are more proficient,5.377,5.377,6.398,1,Move no one,2.375,2.375,4.083,1,Move no one,7.761,7.761,9.169,1,Move no one,5.087,5.087,13.443,1,Move no one,7.18,17.378,18.29,2,Scenario 2 is better for my class,8.313,8.313,10.725,1,Scenario 1 is better for my class,6.057,6.057,7.623,1,Scenario 1 is better for my class,16.571,16.571,18.015,1,Scenario 2 is better for my class,84.463,84.463,85.695,1,Grouped Bar Graph is easier to understand,"I think the grouped bar graph is more easy to understand because it there isn't a lot of calculations to do, that is the skill level can be spotted easily on the grouped bar graph"
2021-12-07 13:55:50,2021-12-07 14:18:55,IP Address,70.36.59.148,100,1385,True,2021-12-07 14:18:56,R_2xV4DjyC8VUfgEc,,,,,49.2765045166015625,-123.12469482421875,anonymous,EN,Members in Team D are more proficient,30.399,30.399,36.473,1,Members in Team C are more proficient,15.194,15.194,16.559,1,Members in Team C are more proficient,12.418,12.418,17.022,1,Members in Team D are more proficient,17.275,18.257,18.763,2,Members in Team H are more proficient,9.131,9.131,14.707,1,Members in Team H are more proficient,8.211,9.446,10.95,2,Members in Team G are more proficient,4.009,4.734,5.15,2,Members in Team G are more proficient,1.953,1.953,3.478,1,Move Andy to team B,47.122,47.122,65.399,1,Move Blake to team B,27.933,40.508,43.014,5,Move no one,6.37,44.257,53.775,5,Move no one,7.354,53.26,73.738,2,Scenario 1 is better for my class,67.846,69.705,71.97,3,Scenario 2 is better for my class,19.312,19.312,21.307,1,Scenario 2 is better for my class,10.927,31.919,42.368,6,Scenario 1 is better for my class,15.321,15.321,16.504,1,Members in Team B are more proficient,22.16,25.647,29.365,2,Members in Team A are more proficient,3.246,4.314,8.094,2,Members in Team B are more proficient,4.052,4.052,5.445,1,Members in Team B are more proficient,4.008,4.008,5.58,1,Members in Team F are more proficient,17.934,17.934,21.022,1,Members in Team E are more proficient,21.46,21.46,28.718,1,Members in Team F are more proficient,14.151,14.151,23.014,1,Members in Team E are more proficient,2.543,18.479,20.025,13,Move Cole to team B,27.467,27.467,43.732,1,Move Sid to Team B,20.865,63.918,65.173,8,Move no one,8.682,8.682,9.891,1,Move no one,25.295,25.295,26.629,1,Scenario 1 is better for my class,4.393,50.393,52.172,2,Scenario 1 is better for my class,22.236,22.236,25.003,1,Scenario 1 is better for my class,10.196,10.196,12.675,1,I can't tell from graphs,43.489,44.592,49.824,2,Stacked Bar Graph is easier to understand,"Stacked was usually easier to interpret quickly as it clearly shows how much each student contributes to the skill, making it easier when asked to move students across teams"
